1,baat online kr rhe the bhai...abhi 5 bje khtm hua h,19078,79432,../../NewData/BeingSalmanKhan_comment_07_17_18_03.txt,41423,883778841710320_884069778347893
1,Salman sir or pata chala hai ki aap aajkal jaada gym me time bitate hai..? is baat me kitni sachhi hai? or agar sach hai to kya aap kis new movie ke leye body bana rahe hai,19081,79448,../../NewData/BeingSalmanKhan_comment_07_17_18_03.txt,41439,883778841710320_884070011681203
0,Fake fake ....fake ye fake h. Suna sabny,19082,79452,../../NewData/BeingSalmanKhan_comment_07_17_18_03.txt,41443,883778841710320_884070055014532
1,Frnds bnd kro rply krna plz,19084,79461,../../NewData/BeingSalmanKhan_comment_07_17_18_03.txt,41452,883778841710320_884070128347858
0,Kafir wala name hi mila tha ap ko,19087,79466,../../NewData/BeingSalmanKhan_comment_07_17_18_03.txt,41457,883778841710320_884070218347849
1,Salman plz  plz  fulfill my 1 wish,19097,79490,../../NewData/BeingSalmanKhan_comment_07_17_18_03.txt,41481,883778841710320_884070521681152
1,plss salmAn rply kr do ....<3,19099,79492,../../NewData/BeingSalmanKhan_comment_07_17_18_03.txt,41483,883778841710320_884070551681149
1,Mr. KHAN aapki mummy apko fb pe aane nahi de rahi h kya,19100,79493,../../NewData/BeingSalmanKhan_comment_07_17_18_03.txt,41484,883778841710320_884070565014481
1,Bhaijaan etna wait toh bndi ke reply ka ni kiya,19107,79509,../../NewData/BeingSalmanKhan_comment_07_17_18_03.txt,41500,883778841710320_884070738347797
1,Na kro yr cmnts plz frnds,19109,79515,../../NewData/BeingSalmanKhan_comment_07_17_18_03.txt,41506,883778841710320_884070811681123
1,Aisay ha bhaiya bajrangi......,19116,79532,../../NewData/BeingSalmanKhan_comment_07_17_18_03.txt,41523,883778841710320_884071081681096
0,Sir app shooting main bhi late jate hain.. aur aaj yaha pe bhi late...!!!,19121,79542,../../NewData/BeingSalmanKhan_comment_07_17_18_03.txt,41533,883778841710320_884071291681075
1,lagta hai aap bahut busy ho par please ek bar bata do dete sir,19123,79544,../../NewData/BeingSalmanKhan_comment_07_17_18_03.txt,41535,883778841710320_884071338347737
1,"bahi,,kesehe ap??",19129,79559,../../NewData/BeingSalmanKhan_comment_07_17_18_03.txt,41550,883778841710320_884071515014386
1,tiger bahoot busy hai abhi... dont disterb cat,19131,79566,../../NewData/BeingSalmanKhan_comment_07_17_18_03.txt,41557,883778841710320_884071595014378
0,Allah tomi jan te ho. jan te ho aap kahbi nahi bat korogi mare sath.,19138,79590,../../NewData/BeingSalmanKhan_comment_07_17_18_03.txt,41581,883778841710320_884072075014330
1,Jodhpur aaoge jab milo ga...mai ab..kaha jaoge mujse bach ke..saadi gali tu ana hi padega,19140,79599,../../NewData/BeingSalmanKhan_comment_07_17_18_03.txt,41590,883778841710320_884072275014310
0,Mazak bahot krte ho.... ;),19147,79615,../../NewData/BeingSalmanKhan_comment_07_17_18_03.txt,41606,883778841710320_884072461680958
0,Sir aapne reply nahi kiya !!,19157,79631,../../NewData/BeingSalmanKhan_comment_07_17_18_03.txt,41622,883778841710320_884072645014273
2,Bhaaai hv to goIt z urgnt Fer kbi krenge baat Bye byeWish u gud luck fr ur movie fr ur lyfHv a smyl olwayzz Khyaal rkhiyee. ..,19158,79634,../../NewData/BeingSalmanKhan_comment_07_17_18_03.txt,41625,883778841710320_884072708347600
1,Reply bhai jaldi aao,19173,79675,../../NewData/BeingSalmanKhan_comment_07_17_18_03.txt,41666,883778841710320_884073288347542
1,bhai musalman h ap toh jante honge  salam krna sunnat hai aur jawab dena wajib.          assalmu alaikum bhai,19180,79708,../../NewData/BeingSalmanKhan_comment_07_17_18_03.txt,41699,883778841710320_884073728347498
1,Hmm mje pta Ni chla soo gyi thi fever tha..u r my jaan salmaan..,19181,79714,../../NewData/BeingSalmanKhan_comment_07_17_18_03.txt,41705,883778841710320_884073791680825
0,Film se fursat nahi roza ka khak rakhe ge salman bhai,19184,79726,../../NewData/BeingSalmanKhan_comment_07_17_18_03.txt,41717,883778841710320_884073955014142
1,Kab bat karenge salman ji app we r waiting ..pls rply....,19185,79729,../../NewData/BeingSalmanKhan_comment_07_17_18_03.txt,41720,883778841710320_884074095014128
1,Bhai saab kaha hai,19198,79759,../../NewData/BeingSalmanKhan_comment_07_17_18_03.txt,41750,883778841710320_884074551680749
1,wanted salman khan,19201,79767,../../NewData/BeingSalmanKhan_comment_07_17_18_03.txt,41758,883778841710320_884074728347398
1,Bhai jan  jab awogay mujhe reply karna plzzz am waiting,19209,79788,../../NewData/BeingSalmanKhan_comment_07_17_18_03.txt,41779,883778841710320_884075045014033
1,Apke liye possible nai hai sbko persanaly reply krna to apne ek bar me sbko thanx bol diya..acha hai..,19210,79790,../../NewData/BeingSalmanKhan_comment_07_17_18_03.txt,41781,883778841710320_884075055014032
0,Rinky Kumari salman hai vo alva nahi hai,19218,79813,../../NewData/BeingSalmanKhan_comment_07_17_18_03.txt,41804,883778841710320_884075285014009
1,kamaal karte ho Q intzar kra rhe ho,19219,79817,../../NewData/BeingSalmanKhan_comment_07_17_18_03.txt,41808,883778841710320_884075321680672
1,aap thoda aur abs pe dhayan q ni dete? Aur tight muscular body banane pe,19225,79830,../../NewData/BeingSalmanKhan_comment_07_17_18_03.txt,41821,883778841710320_884075625013975
0,Tu Kitna bhi krle Salman teri bajrangi bhaijaan flop ho ker rahegi insaallah,19243,79873,../../NewData/BeingSalmanKhan_comment_07_17_18_03.txt,41864,883778841710320_884076195013918
0,Asa karo pagalo yahi rukna me badi wali bus lata hu us me tum sabko bharkar mental hospital ly jaoga waha apko electric short lagygy pagal pan thek ho jaega,19245,79878,../../NewData/BeingSalmanKhan_comment_07_17_18_03.txt,41869,883778841710320_884076271680577
1,Kis kis ko rply denge salman...uffffff....jisko salman bahut achha lagta hain usko dena....,19254,79904,../../NewData/BeingSalmanKhan_comment_07_17_18_03.txt,41895,883778841710320_884076608347210
2,Salman bhaaaiiiii ilovee uuu alooottt...,19257,79912,../../NewData/BeingSalmanKhan_comment_07_17_18_03.txt,41903,883778841710320_884076691680535
1,Sir aap kab aaoge muja gym Jana hai,19259,79916,../../NewData/BeingSalmanKhan_comment_07_17_18_03.txt,41907,883778841710320_884076731680531
1,bhai kch hi cmnt me 50000 ko paar kr jyga ab tu hello hye bye bol do zzzzzzzzz,19262,79927,../../NewData/BeingSalmanKhan_comment_07_17_18_03.txt,41918,883778841710320_884076855013852
1,kasm  khuda  ki  itna  toh  class12  ke result ke din  v  exitmnt ny  tha.,19264,79931,../../NewData/BeingSalmanKhan_comment_07_17_18_03.txt,41922,883778841710320_884076881680516
1,salman bhai kaha ho aap replay kuy nahi dayrahay ho,19266,79936,../../NewData/BeingSalmanKhan_comment_07_17_18_03.txt,41927,883778841710320_884076945013843
1,<b>BHAAI LAGTA H BAHUT BUSY HO KOI NAHI HOTA BUT ITNA,19267,79942,../../NewData/BeingSalmanKhan_comment_07_17_18_03.txt,41933,883778841710320_884077048347166
0,Salman sir or kya aap baat nhi karege yaa time nhi hai aapke pass,19268,79947,../../NewData/BeingSalmanKhan_comment_07_17_18_03.txt,41938,883778841710320_884077101680494
1,Hlloooo bhaijaan kha ho,19270,79952,../../NewData/BeingSalmanKhan_comment_07_17_18_03.txt,41943,883778841710320_884077181680486
1,vhi jan aap dhoom 4 jarur karna ha......,19271,79959,../../NewData/BeingSalmanKhan_comment_07_17_18_03.txt,41950,883778841710320_884077268347144
1,plzz bhaii come to nanitaall tooo plzz .......,19278,79978,../../NewData/BeingSalmanKhan_comment_07_17_18_03.txt,41969,883778841710320_884077495013788
0,5 hogaye pr ap ne baat nh ki angry with you kamal kartay ho yar,19279,79984,../../NewData/BeingSalmanKhan_comment_07_17_18_03.txt,41975,883778841710320_884077545013783
1,Kr to rha hoo,19281,79990,../../NewData/BeingSalmanKhan_comment_07_17_18_03.txt,41981,883778841710320_884077631680441
2,Bhai plzz ao na bajrangi bhaijaan bajrangi bhaijaan bajrangi bhaijaan bajrangi bhaijaan bajrangi bhaijaan bajrangi bhaijaan bajrangi Jai bajrang bali Tod de dushman ki nali,19283,79997,../../NewData/BeingSalmanKhan_comment_07_17_18_03.txt,41988,883778841710320_884077791680425
1,buhat buhst shukriya bhai,19286,80001,../../NewData/BeingSalmanKhan_comment_07_17_18_03.txt,41992,883778841710320_884077815013756
1,Salman sir aapko Agae sach main pakistan aana ho to aap ko khushi hogi kia,19288,80006,../../NewData/BeingSalmanKhan_comment_07_17_18_03.txt,41997,883778841710320_884077941680410
1,Salman bhai ...  Aaj b reply nhi aaya to kya smjhu?,19290,80009,../../NewData/BeingSalmanKhan_comment_07_17_18_03.txt,42000,883778841710320_884078035013734
1,Ha jao jao kon rok rha h tumen,19293,80019,../../NewData/BeingSalmanKhan_comment_07_17_18_03.txt,42010,883778841710320_884078221680382
1,Kise.. aapna number de k jao sallu bhai...,19295,80023,../../NewData/BeingSalmanKhan_comment_07_17_18_03.txt,42014,883778841710320_884078285013709
1,kamaal karte ho Salman ji aayeh bhi nahi..,19297,80028,../../NewData/BeingSalmanKhan_comment_07_17_18_03.txt,42019,883778841710320_884078355013702
1,wtng for ur rply ....plz,19298,80038,../../NewData/BeingSalmanKhan_comment_07_17_18_03.txt,42029,883778841710320_884078548347016
0,Kya app n kha tha k  musalmamo k bina m bajrangi bhaijan hit kr k dikhauna reply me bhai,19299,80039,../../NewData/BeingSalmanKhan_comment_07_17_18_03.txt,42030,883778841710320_884078555013682
1,#burak...helloo...bigan,19301,80048,../../NewData/BeingSalmanKhan_comment_07_17_18_03.txt,42039,883778841710320_884078705013667
1,Ammi bularahi ha,19315,80085,../../NewData/BeingSalmanKhan_comment_07_17_18_03.txt,42076,883778841710320_884079501680254
1,bhai jkasm se pehela hi show dekhege ab sare ap ki b b ka,19317,80090,../../NewData/BeingSalmanKhan_comment_07_17_18_03.txt,42081,883778841710320_884079578346913
1,kis kis ki bat hogae,19325,80110,../../NewData/BeingSalmanKhan_comment_07_17_18_03.txt,42101,883778841710320_884079961680208
1,bhai ek request h jab movie k mid m intrrval ho tb kisi film k promo k bajay aapke dwara kiye gye #SwachhBharat k video ko zaroor dikhna. jis se indians bhi swachh bharat k prati zagrook ho jaye.,19326,80116,../../NewData/BeingSalmanKhan_comment_07_17_18_03.txt,42107,883778841710320_884080068346864
1,"hy bhai,life ek wish hai bas ek bar tumhe gaale milooo......",19328,80124,../../NewData/BeingSalmanKhan_comment_07_17_18_03.txt,42115,883778841710320_884080201680184
1,Just 4 fun.. ks ks ko reply krogy ko sallu,19335,80146,../../NewData/BeingSalmanKhan_comment_07_17_18_03.txt,42137,883778841710320_884080471680157
1,bhai ek request h jab movie k mid m intrrval ho tb kisi film k promo k bajay aapke dwara kiye gye #SwachhBharat k video ko zaroor dikhna. jis se indians bhi swachh bharat k prati zagrook ho jaye. bhai plz reply once,19338,80153,../../NewData/BeingSalmanKhan_comment_07_17_18_03.txt,42144,883778841710320_884080545013483
1,arbaaz bhi thik kehte the aap less puntual hai,19341,80162,../../NewData/BeingSalmanKhan_comment_07_17_18_03.txt,42153,883778841710320_884080655013472
1,"Bhai hisar,haryana m aajao",19343,80165,../../NewData/BeingSalmanKhan_comment_07_17_18_03.txt,42156,883778841710320_884080715013466
1,ek reply mujhe bi kardo bhai,19344,80172,../../NewData/BeingSalmanKhan_comment_07_17_18_03.txt,42163,883778841710320_884080831680121
0,Paya Thakur nahi ata vo tum ko kuch kam hai kya to kar ke ajo,19351,80190,../../NewData/BeingSalmanKhan_comment_07_17_18_03.txt,42181,883778841710320_884081055013432
1,upar live webcast par click karo aur dekho,19355,80201,../../NewData/BeingSalmanKhan_comment_07_17_18_03.txt,42192,883778841710320_884081305013407
1,kaha pe karinge baigan ;),19362,80220,../../NewData/BeingSalmanKhan_comment_07_17_18_03.txt,42211,883778841710320_884081678346703
0,sir ticket k paise ni hai 2 ticket bhejo,19369,80243,../../NewData/BeingSalmanKhan_comment_07_17_18_03.txt,42234,883778841710320_884082185013319
1,Sar aap se to bahot logo ne kaha hoga ki sar ek moka dedo mai mahent to karuga ek baar filmo me aane ke liye sar agar aap ye pahd rahe hai to reply dena plz,19377,80268,../../NewData/BeingSalmanKhan_comment_07_17_18_03.txt,42259,883778841710320_884082618346609
1,Kia wakai Salman Khan bat kr rha he kuch logo se....,19381,80279,../../NewData/BeingSalmanKhan_comment_07_17_18_03.txt,42270,883778841710320_884082768346594
1,assalam o alaikum salman sir kse ho ap 4th jumma of ramadan mubarak ho apko,19383,80285,../../NewData/BeingSalmanKhan_comment_07_17_18_03.txt,42276,883778841710320_884082888346582
0,ye  l0... server d0wn,19384,80289,../../NewData/BeingSalmanKhan_comment_07_17_18_03.txt,42280,883778841710320_884082948346576
1,Reply krdo bhaaaaaaaaaaaaaaaai,19385,80290,../../NewData/BeingSalmanKhan_comment_07_17_18_03.txt,42281,883778841710320_884082971679907
1,Abey chat hogaya kab ka..yahan thodi hoga chat..video chat tha..woh hogaya 10 min pahle khatam,19387,80306,../../NewData/BeingSalmanKhan_comment_07_17_18_03.txt,42297,883778841710320_884083361679868
1,3.30 baje kaha or ab 5.30 bajane wale h abi tak aap nahi aaye kitna wait kare salman .i really love u salman,19388,80307,../../NewData/BeingSalmanKhan_comment_07_17_18_03.txt,42298,883778841710320_884083371679867
1,<b>BHAAI COMENTSS KRTE KARTE BETTRY LOW HONE KO AAYI YE KYA BAAT YR,19390,80314,../../NewData/BeingSalmanKhan_comment_07_17_18_03.txt,42305,883778841710320_884083445013193
1,#Ap sb k coment prh rhe   hen salman bhai.,19395,80338,../../NewData/BeingSalmanKhan_comment_07_17_18_03.txt,42329,883778841710320_884083791679825
1,Aisa h mujhse milo aapse kuch batein puchni h,19397,80340,../../NewData/BeingSalmanKhan_comment_07_17_18_03.txt,42331,883778841710320_884083828346488
1,sun0  gaowal0... bhai  raat k0  aaenge,19398,80346,../../NewData/BeingSalmanKhan_comment_07_17_18_03.txt,42337,883778841710320_884083875013150
2,Hiiii me aap ki sab se bati Fan hoooooo.....                      ????????,19403,80355,../../NewData/BeingSalmanKhan_comment_07_17_18_03.txt,42346,883778841710320_884084038346467
1,aap tho bat nahi kar rahi ho. wadda kiya bat korogi aap,19411,80377,../../NewData/BeingSalmanKhan_comment_07_17_18_03.txt,42368,883778841710320_884084641679740
1,aao salman mujh se milne,19412,80378,../../NewData/BeingSalmanKhan_comment_07_17_18_03.txt,42369,883778841710320_884084648346406
0,Koi dhkta bhi hoga etne comment.,19413,80379,../../NewData/BeingSalmanKhan_comment_07_17_18_03.txt,42370,883778841710320_884084655013072
0,Kon kambakht ap se bt nai karna chahega #Salmankhan bhai,19416,80387,../../NewData/BeingSalmanKhan_comment_07_17_18_03.txt,42378,883778841710320_884084795013058
1,Sir aap indore aoge kya promotion ke liye.,19417,80396,../../NewData/BeingSalmanKhan_comment_07_17_18_03.txt,42387,883778841710320_884084915013046
1,Dekhna friends Salman bhai zaror reply kary ga late hi sahi,19420,80409,../../NewData/BeingSalmanKhan_comment_07_17_18_03.txt,42400,883778841710320_884085038346367
0,4:pm din b to bataae nah bahi ? bewakooof banaadiyaaa bahi apne to,19431,80425,../../NewData/BeingSalmanKhan_comment_07_17_18_03.txt,42416,883778841710320_884085285013009
1,Apki ek mve ko itni bheed me ladke tck lekar or dosto ki bheed leke 3 3 time mve dekne jata hu or ap ho ki...,19438,80450,../../NewData/BeingSalmanKhan_comment_07_17_18_03.txt,42441,883778841710320_884085575012980
1,Bhai 2hours ho hai kab aap aaoge,19446,80475,../../NewData/BeingSalmanKhan_comment_07_17_18_03.txt,42466,883778841710320_884086155012922
2,Is baar ni hua katti bt nxt time jarur ho jauga...love u bhaijaan.......mmmmuuuuuuaaaaahhhhhhhh,19447,80479,../../NewData/BeingSalmanKhan_comment_07_17_18_03.txt,42470,883778841710320_884086211679583
1,Aap mre fvrt ho pr aap rpl to kro,19448,80482,../../NewData/BeingSalmanKhan_comment_07_17_18_03.txt,42473,883778841710320_884086275012910
0,bahut wt kiya aur nahi....bye...gussa hu app sa,19451,80487,../../NewData/BeingSalmanKhan_comment_07_17_18_03.txt,42478,883778841710320_884086368346234
1,"Hiii sir , aapse milne kaa sirf ek maaukaa chaahtaa hu.  ....",19453,80494,../../NewData/BeingSalmanKhan_comment_07_17_18_03.txt,42485,883778841710320_884086428346228
1,Bhai jan 5 sy b uper ho gya time :\  kaha ho,19456,80502,../../NewData/BeingSalmanKhan_comment_07_17_18_03.txt,42493,883778841710320_884086535012884
0,Bhai shaadi b kroge ya randwe hi mroge,19459,80505,../../NewData/BeingSalmanKhan_comment_07_17_18_03.txt,42496,883778841710320_884086558346215
0,Fek    I'd  hai,19462,80517,../../NewData/BeingSalmanKhan_comment_07_17_18_03.txt,42508,883778841710320_884086725012865
1,Sir pleazz aap online aao,19476,80565,../../NewData/BeingSalmanKhan_comment_07_17_18_03.txt,42556,883778841710320_884087625012775
1,bhaiyya maine bahut intzar kiya lagta hai aap jayada busy hai koi bat nai kal jarur reply karna kal school ki chhuti b hai pls bhai,19478,80571,../../NewData/BeingSalmanKhan_comment_07_17_18_03.txt,42562,883778841710320_884087745012763
0,oh bhai mere luck kitnakharap twtr nahe ho raha,19482,80585,../../NewData/BeingSalmanKhan_comment_07_17_18_03.txt,42576,883778841710320_884087911679413
0,Bhay ab mera net pack khatam hone aya he,19491,80624,../../NewData/BeingSalmanKhan_comment_07_17_18_03.txt,42615,883778841710320_884088431679361
1,salman bhai men aap ka bohot bara fan hun,19499,80647,../../NewData/BeingSalmanKhan_comment_07_17_18_03.txt,42638,883778841710320_884088878345983
1,tum achi acting krta h,19502,80652,../../NewData/BeingSalmanKhan_comment_07_17_18_03.txt,42643,883778841710320_884088971679307
1,mujhe chota mota kaam dedo bhai bal bacche duaye denge,19518,80684,../../NewData/BeingSalmanKhan_comment_07_17_18_03.txt,42675,883778841710320_884089455012592
1,Kb bat krenge...kbse wait kr rhe h...Salman ji apka..kb bat kroge ab hmse...,19534,80754,../../NewData/BeingSalmanKhan_comment_07_17_18_03.txt,42745,883778841710320_884090895012448
0,Hihihi sab ko ullu bana raha he salman,19550,80791,../../NewData/BeingSalmanKhan_comment_07_17_18_03.txt,42782,883778841710320_884091701679034
1,live india pat baat kar rahe hai vo,19557,80812,../../NewData/BeingSalmanKhan_comment_07_17_18_03.txt,42803,883778841710320_884092101678994
1,Bhai k sath apun kab se baat karnay ka soch hi raha tha..Whats  App pr aah jana..,19563,80824,../../NewData/BeingSalmanKhan_comment_07_17_18_03.txt,42815,883778841710320_884092281678976
1,meri baat to ho gae..... A biggggg thanks sallu :-*,19564,80825,../../NewData/BeingSalmanKhan_comment_07_17_18_03.txt,42816,883778841710320_884092285012309
0,Huhhh Watse our time ..... 3:30 se 4:00 Or ab tk ata pta nhi,19565,80827,../../NewData/BeingSalmanKhan_comment_07_17_18_03.txt,42818,883778841710320_884092345012303
1,bhai jaan ek baar me aap se milna chahta hu bhai jaan please please,19567,80841,../../NewData/BeingSalmanKhan_comment_07_17_18_03.txt,42832,883778841710320_884092528345618
0,kya bat karu ??  Bangladesh main jo Hindu k satha jo horaha hain... baat kar k kya hoga ??,19574,80856,../../NewData/BeingSalmanKhan_comment_07_17_18_03.txt,42847,883778841710320_884093148345556
1,Sir baat kr lo plzzzzzzzzzzzzzzzzzzzzzzzzzzzzz,19579,80882,../../NewData/BeingSalmanKhan_comment_07_17_18_03.txt,42873,883778841710320_884093681678836
1,to aap hme rply ni krenge because mai aapko ideal manta hu?,19582,80893,../../NewData/BeingSalmanKhan_comment_07_17_18_03.txt,42884,883778841710320_884093811678823
0,sir ye too National tragedy hoo jayegii agar ajj apne fan ko reply nahi diyaa ;),19599,80954,../../NewData/BeingSalmanKhan_comment_07_17_18_03.txt,42945,883778841710320_884094681678736
1,Pehle main milna chahti hu,19604,80965,../../NewData/BeingSalmanKhan_comment_07_17_18_03.txt,42956,883778841710320_884094985012039
1,kitna paisa kama lega bajrangi,19605,80967,../../NewData/BeingSalmanKhan_comment_07_17_18_03.txt,42958,883778841710320_884095005012037
1,Direct baat salman khan sir ke sath wooooooooo,19611,80994,../../NewData/BeingSalmanKhan_comment_07_17_18_03.txt,42985,883778841710320_884095868345284
1,koi ta msg krdo Salman Khan,19612,81002,../../NewData/BeingSalmanKhan_comment_07_17_18_03.txt,42993,883778841710320_884096025011935
1,Aate aaz bhai,19613,81005,../../NewData/BeingSalmanKhan_comment_07_17_18_03.txt,42996,883778841710320_884096085011929
1,hlo  salman sir,19624,81030,../../NewData/BeingSalmanKhan_comment_07_17_18_03.txt,43021,883778841710320_884096648345206
1,Hamara pani chala jayega. Pls jaldi a jao,19625,81034,../../NewData/BeingSalmanKhan_comment_07_17_18_03.txt,43025,883778841710320_884096718345199
1,plz plz plz reply,19637,81085,../../NewData/BeingSalmanKhan_comment_07_17_18_03.txt,43076,883778841710320_884097925011745
1,plz sir ek reply kar dijiyega......mai bahut happy ho jaunga..,19638,81086,../../NewData/BeingSalmanKhan_comment_07_17_18_03.txt,43077,883778841710320_884097958345075
0,Pagalo aa gae bus chalo ghus jao bus me jiyada aur rahy yaha to phir apka koi ilaj nhi,19650,81122,../../NewData/BeingSalmanKhan_comment_07_17_18_03.txt,43113,883778841710320_884098745011663
0,aisi ummeed nhi thi aapse bhaijaan. . DIL tod diya sbka :-(,19673,81218,../../NewData/BeingSalmanKhan_comment_07_17_18_03.txt,43209,883778841710320_884100468344824
1,Aby yr kdr gum o gy ho rply tou kr do,19674,81219,../../NewData/BeingSalmanKhan_comment_07_17_18_03.txt,43210,883778841710320_884100488344822
1,kch status dal,19677,81227,../../NewData/BeingSalmanKhan_comment_07_17_18_03.txt,43218,883778841710320_884100588344812
2,kyoki ittana pyr tumko  krte he hum,19683,81239,../../NewData/BeingSalmanKhan_comment_07_17_18_03.txt,43230,883778841710320_884100791678125
1,Sab log sun lo salman bhai rat ke 10 bje aayenge,19686,81245,../../NewData/BeingSalmanKhan_comment_07_17_18_03.txt,43236,883778841710320_884100865011451
1,Kia  baat  kary gy,19695,81271,../../NewData/BeingSalmanKhan_comment_07_17_18_03.txt,43262,883778841710320_884101745011363
1,"Salman bhai may apke sath India ka garib or khana ,kapra na Milne walo ko apniii puri samata  sey  help karna chah  ta hu.....plzzz help and thora support me plzzz",19699,81289,../../NewData/BeingSalmanKhan_comment_07_17_18_03.txt,43280,883778841710320_884101931678011
1,veerji mainu aapse baat kar ke hi chain aayega,19706,81308,../../NewData/BeingSalmanKhan_comment_07_17_18_03.txt,43299,883778841710320_884102205011317
2,jaldi relese kro yr  BB Film ab wait nahi ho raha hai,19710,81318,../../NewData/BeingSalmanKhan_comment_07_17_18_03.txt,43309,883778841710320_884102315011306
1,Salmaan sir ho sake to pls sir baat kr lena humse bhi mai bachpan se aapka fan hu,19722,81348,../../NewData/BeingSalmanKhan_comment_07_17_18_03.txt,43339,883778841710320_884102748344596
1,Kya baat kya baat kya baat.....!!!!,19723,81350,../../NewData/BeingSalmanKhan_comment_07_17_18_03.txt,43341,883778841710320_884102781677926
1,Yaar frnds aap sabko such mein lagta hai ye salman bhai ki id hai,19724,81353,../../NewData/BeingSalmanKhan_comment_07_17_18_03.txt,43344,883778841710320_884102805011257
1,salman sir so rhe h....don't disturb,19730,81365,../../NewData/BeingSalmanKhan_comment_07_17_18_03.txt,43356,883778841710320_884102925011245
1,jawab deyde...?? :( :( #livechatwithsalmankhan,19734,81380,../../NewData/BeingSalmanKhan_comment_07_17_18_03.txt,43371,883778841710320_884103201677884
1,Pata ni kabhi meri b kismat mehrbaan hogi or me b bhai jaan se mil paunga..Ae khuda. Raham..:-) <3,19737,81389,../../NewData/BeingSalmanKhan_comment_07_17_18_03.txt,43380,883778841710320_884103391677865
1,hello sallu bhaijan...,19744,81402,../../NewData/BeingSalmanKhan_comment_07_17_18_03.txt,43393,883778841710320_884103615011176
1,salman bhai kaha ho ??,19751,81414,../../NewData/BeingSalmanKhan_comment_07_17_18_03.txt,43405,883778841710320_884103821677822
1,Salman bhai rat ke 10 bje aayenge. Mob no of salman khan is 9999999999 real h.,19753,81421,../../NewData/BeingSalmanKhan_comment_07_17_18_03.txt,43412,883778841710320_884104115011126
1,Agar aaj Maine pyar kiya relies hoti to kitna hit hoti?,19754,81422,../../NewData/BeingSalmanKhan_comment_07_17_18_03.txt,43413,883778841710320_884104141677790
0,wo bahut busy hai kisi kaam me hoge is liye nahi aaye socha hoga tab tak kam pura ho jayega but nahi ho paya hoga kaam pura to nahi aa paye,19757,81430,../../NewData/BeingSalmanKhan_comment_07_17_18_03.txt,43421,883778841710320_884104325011105
2,loveeeeeeeeeeeeeeeeeeeeeeee uuuuuuuuuu salmaannnnnnnnmnmm sir,19758,81431,../../NewData/BeingSalmanKhan_comment_07_17_18_03.txt,43422,883778841710320_884104335011104
1,sir ek spna h zindgi m ek bar milna h aapse,19763,81443,../../NewData/BeingSalmanKhan_comment_07_17_18_03.txt,43434,883778841710320_884104608344410
1,Itna intezar to roza khulna ka bhi ni krta jitna apka ek post ka karta hooo ....plzz reply  karain maharbani apki bhtt bhtt,19765,81445,../../NewData/BeingSalmanKhan_comment_07_17_18_03.txt,43436,883778841710320_884104638344407
1,BDA HI ACHCHHA MJAK KRTE HO pandey g,19778,81475,../../NewData/BeingSalmanKhan_comment_07_17_18_03.txt,43466,883778841710320_884105138344357
2,Bhaijaan me apki film ka fan km hu or jo apke dil me insaniyet ke liye jghe he uska bhut fan hu u r real hero and my fav film of urs hum sath sath he    and jai ho,19779,81479,../../NewData/BeingSalmanKhan_comment_07_17_18_03.txt,43470,883778841710320_884105191677685
1,bhaijaan 4pm pe phn kr lena mujhe apne us din mujhe apna no. Diya tha to mene save ni kiya tha ap yaad se mujhe call kr lena ok by i'm busy somewear,19783,81491,../../NewData/BeingSalmanKhan_comment_07_17_18_03.txt,43482,883778841710320_884105348344336
1,Asslawalecom salman bhai..,19784,81492,../../NewData/BeingSalmanKhan_comment_07_17_18_03.txt,43483,883778841710320_884105358344335
1,hlo sir kuch to kho,19788,81501,../../NewData/BeingSalmanKhan_comment_07_17_18_03.txt,43492,883778841710320_884105491677655
1,Salman bhai kaha ho ap,19789,81506,../../NewData/BeingSalmanKhan_comment_07_17_18_03.txt,43497,883778841710320_884105605010977
2,Salman bhai apke 50000 comments pure hone bale hai.,19801,81541,../../NewData/BeingSalmanKhan_comment_07_17_18_03.txt,43532,883778841710320_884106095010928
0,hamay tu muqa bh nahi mila,19803,81548,../../NewData/BeingSalmanKhan_comment_07_17_18_03.txt,43539,883778841710320_884106221677582
