2,Ye song nahi hi Ye MODI Ji ka mehnat ka rang hi wo ek din pura world me dikhe ga ye to sirf Turkmenistan. hi hai.. Great MODi ji,3778,23140,../../NewData/narendramodi_comment_07_16_18_22.txt,17535,10155900086255165_10155900108180165
1,Ye to hamare Hindustan ke liye garv ki bat hai. JAY HIND,3847,23423,../../NewData/narendramodi_comment_07_16_18_22.txt,17818,10155900086255165_10155900145775165
2,Love u sir love u soo much urs I'ts beautyful vedio ...,3897,23687,../../NewData/narendramodi_comment_07_16_18_22.txt,18082,10155900086255165_10155900167175165
1,Arae sur jee pahelae hamare bharat ke bachho ka parao.... Firr vedesh may jao yaar,3780,23156,../../NewData/narendramodi_comment_07_16_18_22.txt,17551,10155900086255165_10155900189335165
2,Wah! Jitni sundar geet ke bhao hain utnihi sundar aur sureeli aawaz hai .,3982,24650,../../NewData/narendramodi_comment_07_16_18_22.txt,19045,10155900086255165_10155900194060165
1,Narendra Modi ji ne ekatha ka sanket hai...,3878,23525,../../NewData/narendramodi_comment_07_16_18_22.txt,17920,10155900086255165_10155900212515165
1,I love you india ram yadaw hmare desh wasiy ko namas kar raha hu ram yadaw 5,3863,23470,../../NewData/narendramodi_comment_07_16_18_22.txt,17865,10155900086255165_10155900232445165
2,Sundar ekdam sahi Gaya Hua gana.chhotisi gudiya ko naman,3869,23491,../../NewData/narendramodi_comment_07_16_18_22.txt,17886,10155900086255165_10155900242455165
2,Wao lata mangekar,3979,24632,../../NewData/narendramodi_comment_07_16_18_22.txt,19027,10155900086255165_10155900266590165
2,"Aatma aur mun ki pavitrata ki jhalak hai is beti ki aawaz mei, khush raho beti.",3898,23690,../../NewData/narendramodi_comment_07_16_18_22.txt,18085,10155900086255165_10155900269660165
2,Joy hind joy hindMeri bhatan tuje salamModi ji aapko salam,3828,23350,../../NewData/narendramodi_comment_07_16_18_22.txt,17745,10155900086255165_10155900318100165
2,Kash Modiji Aap Manmohan Singh se phly aa gy hoty....aj 2015 humara Desh kha phuch gya hota,3795,23241,../../NewData/narendramodi_comment_07_16_18_22.txt,17636,10155900086255165_10155900319655165
0,India me student pe atyachaar karra hai result nahi dikhaijara hai aur yaha ye inke aankho me dhul jhokra hai,3844,23411,../../NewData/narendramodi_comment_07_16_18_22.txt,17806,10155900086255165_10155900327805165
1,:o :o :o,3990,24738,../../NewData/narendramodi_comment_07_16_18_22.txt,19133,10155900086255165_10155900377940165
2,Ye song nahi hi Ye MODI Ji ka mehnat ka rang hi wo ek din pura world me dikha denge  ye to sirf Turkmenistan. hi hai.. Great MODi ji .........great,3787,23206,../../NewData/narendramodi_comment_07_16_18_22.txt,17601,10155900086255165_10155900390540165
2,modiji duniya k masiha he...kafi ku6 kiya he or aage bhi karna he....,3874,23511,../../NewData/narendramodi_comment_07_16_18_22.txt,17906,10155900086255165_10155900397240165
2,BaH Guruji Kya style hai apka duniyako hila ke chhore hain.,3854,23445,../../NewData/narendramodi_comment_07_16_18_22.txt,17840,10155900086255165_10155900420195165
2,Awsome...isey kehte hain hindustan ki chaap chodna poore duniya me...,3841,23401,../../NewData/narendramodi_comment_07_16_18_22.txt,17796,10155900086255165_10155900575990165
1,Namaste MAHA MODI ji!!,3884,23565,../../NewData/narendramodi_comment_07_16_18_22.txt,17960,10155900086255165_10155900647485165
2,Modi ji aap ko shat shat naman hai jo aap ne pure universe me apne hindustan ka parcham laharaya......,3804,23285,../../NewData/narendramodi_comment_07_16_18_22.txt,17680,10155900086255165_10155900649425165
1,hindustan zinda baadh..................!!!,3833,23375,../../NewData/narendramodi_comment_07_16_18_22.txt,17770,10155900086255165_10155900725955165
2,V good Modi ji aap lege rahe hum aapke sath he,3813,23321,../../NewData/narendramodi_comment_07_16_18_22.txt,17716,10155900086255165_10155900990590165
2,"fantabulous... We proud of you Modi Ji...Hamare desh ki tasvir bhi sudharti nazar aa rahi h, sablogon me badlao dikh raha h... India ko apke jaisa hi PM chahiye..Bharat ki kuch zamini samsyaye bhi h jaha dhyan dene ki zarurat h...asha h ki jald hi unme bhi sudhar ayega.",3829,23353,../../NewData/narendramodi_comment_07_16_18_22.txt,17748,10155900086255165_10155901100925165
2,Wah sir g ab desh sahi hatho me gya h apko dekh kar aisa hi lagata h,3904,23722,../../NewData/narendramodi_comment_07_16_18_22.txt,18117,10155900086255165_10155901120110165
0,ISI aik kabotr or bej du,3905,23729,../../NewData/narendramodi_comment_07_16_18_22.txt,18124,10155900086255165_10155901962360165
1,its not hindi its urdu and bolywood ager kamyab hai tu Urdu ki waja say,3850,23433,../../NewData/narendramodi_comment_07_16_18_22.txt,17828,10155900086255165_10155902100425165
0,"Narendra Modi Yeh kya bakchodi pel rahe ho facebook pe, kaam karlo plz!",3797,23246,../../NewData/narendramodi_comment_07_16_18_22.txt,17641,10155900086255165_10155902158585165
1,Kash ye sab bangladesh aur pakistan b gate toh kitna acha hota,3911,23790,../../NewData/narendramodi_comment_07_16_18_22.txt,18185,10155900086255165_10155902346455165
1,wah wah Turkes,3939,24164,../../NewData/narendramodi_comment_07_16_18_22.txt,18559,10155900086255165_10155902355830165
1,Bahut acha....maza aa gaya....bahut surili awaaz hai......barosa nahi hota humari matrbasha ko dusri countries k logh itna pyar aur sammaan dette hai.....I love my india. I love my culture. I love my religion. I love my language.  I love my mother.,3857,23454,../../NewData/narendramodi_comment_07_16_18_22.txt,17849,10155900086255165_10155902523905165
1,beautifull voice .proud to b indian bharat mata ki jai,3997,24834,../../NewData/narendramodi_comment_07_16_18_22.txt,19229,10155900086255165_10155902704895165
2,masha allah good....yeh hain meri hindi,3852,23438,../../NewData/narendramodi_comment_07_16_18_22.txt,17833,10155900086255165_10155904566045165
2,"Wah wah maja aa gya !! Indian Govt. should host an International Hindi song compitition !! Tarrakki bahut ho gayi ab thoda entertainment ho jai, 'Kyo bhayio aur behno' ???",3803,23281,../../NewData/narendramodi_comment_07_16_18_22.txt,17676,10155900086255165_10155906942935165
2,Dil se namaskar sasriya kal ram ram jai shri ram,3662,22338,../../NewData/narendramodi_comment_07_16_18_22.txt,16733,10155900094865165_10155900115820165
0,Mujhe gussa un saale hinduo par aata hai jo nasmjhi me modi ji ka virodh karte hain ..,3619,22217,../../NewData/narendramodi_comment_07_16_18_22.txt,16612,10155900094865165_10155900129180165
0,"Mann ka vishwas kamjor jo na,hum chale neak raste pe humse,bhul kr bhi koi bhul ho na... :) :)",3650,22281,../../NewData/narendramodi_comment_07_16_18_22.txt,16676,10155900094865165_10155900136580165
2,bharat ko vishwa guru banne se koi nahi rok sakta......vande matram,3587,22153,../../NewData/narendramodi_comment_07_16_18_22.txt,16548,10155900094865165_10155900146555165
2,Sir  yeh tho sirf aap hi kar sakte hai. Great sir,3721,22671,../../NewData/narendramodi_comment_07_16_18_22.txt,17066,10155900094865165_10155900148415165
2,Modi jigood preiminister hia,3757,22930,../../NewData/narendramodi_comment_07_16_18_22.txt,17325,10155900094865165_10155900150610165
1,Jai sri ram nama namo,3711,22612,../../NewData/narendramodi_comment_07_16_18_22.txt,17007,10155900094865165_10155900154235165
1,Jan Jan ka viswas kam ho na  jai hind,3628,22235,../../NewData/narendramodi_comment_07_16_18_22.txt,16630,10155900094865165_10155900156810165
2,modi ji aage badho pura desh aapke ssath hai.,3552,22046,../../NewData/narendramodi_comment_07_16_18_22.txt,16441,10155900094865165_10155900162695165
1,RAJ KAPOOR KI FILMO KE BAARE ME SUNA THA KI USSR ME PASAND KI JAATI HAI.LAGTA HAI VAH AAJ BHI KAYAM HAY.,3629,22236,../../NewData/narendramodi_comment_07_16_18_22.txt,16631,10155900094865165_10155900177430165
0,Modi ji agar aap fbj seat se muslim cadidate ko jita dejyega to saat baar pm bana rahega varna samja jayega ki hindutkar kar .B.J.P.JITAKARTA HA,3685,22467,../../NewData/narendramodi_comment_07_16_18_22.txt,16862,10155900094865165_10155900195740165
2,we are proud our pm ; ab lg rha h ki hmara desh ek achchi rah pr chal para hai jaha se hm puri world me apna jhanda gaar skte hai,3630,22237,../../NewData/narendramodi_comment_07_16_18_22.txt,16632,10155900094865165_10155900237440165
2,modi ji aap ki soch bahut sahi lgti hai progres n hona hi sabki wajah hai  is liye sabse zaroori hai ki desh ka vikas ho,3580,22141,../../NewData/narendramodi_comment_07_16_18_22.txt,16536,10155900094865165_10155900306295165
2,"bhrat ko no.1 banne me ab jyada samy nahi lagega,, kyo ki modi ji jaisa pm bade bhagya se milte hai,,jo bharat ki rftar ko bdane me koi kasar nahi chodege,,,,,,,,,jai hind,,,,,,",3585,22148,../../NewData/narendramodi_comment_07_16_18_22.txt,16543,10155900094865165_10155900383940165
2,Baccho k Dilon dimag ko satya k raste pe lane k liya Is geet ko schoolo me vandana k rup me anivarya karna chaheye .,3651,22284,../../NewData/narendramodi_comment_07_16_18_22.txt,16679,10155900094865165_10155900394200165
2,KARTIKEY KUMAR modi hi des ko agä bada sakate hai,3579,22136,../../NewData/narendramodi_comment_07_16_18_22.txt,16531,10155900094865165_10155900482950165
0,Hahaha budha bachiyo ko taar raha h,3758,22978,../../NewData/narendramodi_comment_07_16_18_22.txt,17373,10155900094865165_10155900516230165
2,Aisa PM naa hua hai aur naa hee hoga kabhi. .,3652,22286,../../NewData/narendramodi_comment_07_16_18_22.txt,16681,10155900094865165_10155900614335165
1,koi hindu nhi koi muslim nhi hm sab hundustani hai,3626,22233,../../NewData/narendramodi_comment_07_16_18_22.txt,16628,10155900094865165_10155900642210165
1,Kaya bat hai modi ji jindabad,3716,22630,../../NewData/narendramodi_comment_07_16_18_22.txt,17025,10155900094865165_10155900750345165
0,"Modi tujhe jaan se maarna mera kaam hai , main Khalistani huuuuuuu",3567,22109,../../NewData/narendramodi_comment_07_16_18_22.txt,16504,10155900094865165_10155901308345165
1,Modije mera request hai ke ap apna whatsapp no de take mai live pic apko dekha saku,3715,22625,../../NewData/narendramodi_comment_07_16_18_22.txt,17020,10155900094865165_10155901723410165
2,Modiji ap apne desh ka tirnga sari duni me lahraya hum sabko Garv hai ap per maa bharti ka man duniya me badhaya apne  ap hum bhartvasio ke dil me bas gaye ho salute sir apko jai hind,3594,22166,../../NewData/narendramodi_comment_07_16_18_22.txt,16561,10155900094865165_10155901784810165
1,Hum Bihar ka to jeet gaye aur UP ka election jeeta dena.Abhi to hum 12seaton se jeete hai hume aur humen 65seaton se jeeta dena.,3742,22801,../../NewData/narendramodi_comment_07_16_18_22.txt,17196,10155900094865165_10155901926490165
2,Pm ho to aisa modi jaisa ji hind jay varat,3564,22100,../../NewData/narendramodi_comment_07_16_18_22.txt,16495,10155900094865165_10155901941980165
0,manka biswas kam jor hona...,3684,22450,../../NewData/narendramodi_comment_07_16_18_22.txt,16845,10155900094865165_10155902097575165
0,Modi is tarah so dekhne se kuchh nahi hota,3581,22142,../../NewData/narendramodi_comment_07_16_18_22.txt,16537,10155900094865165_10155902129310165
2,Modi ji hi aise ekmatra person hai jinme desh ko age Le Jane ki sakti aur jajba hai,3570,22123,../../NewData/narendramodi_comment_07_16_18_22.txt,16518,10155900094865165_10155902413110165
2,Mahan bharat ka mahan beta har har modhi,3632,22241,../../NewData/narendramodi_comment_07_16_18_22.txt,16636,10155900094865165_10155902437925165
1,modi ji ko aaram karne do bhai.,3575,22130,../../NewData/narendramodi_comment_07_16_18_22.txt,16525,10155900094865165_10155902504145165
1,Agar yehi bhajan Bhart ki schoolo me subha ganeko kahenge to vo communal aur saffron aajenda ho jayega.,3604,22187,../../NewData/narendramodi_comment_07_16_18_22.txt,16582,10155900094865165_10155902514365165
1,modi ji aage chalo haem aapki jarurat hai,3743,22803,../../NewData/narendramodi_comment_07_16_18_22.txt,17198,10155900094865165_10155902758160165
2,jai ho bharat mata ki w hamari sanskriti ki jo videshi bhi apnate hai,3644,22267,../../NewData/narendramodi_comment_07_16_18_22.txt,16662,10155900094865165_10155902935235165
0,modi sir app pahale  OBC president ho. OBC ke liye kuch karo. bad me koi kuch nahi karega,3631,22238,../../NewData/narendramodi_comment_07_16_18_22.txt,16633,10155900094865165_10155902941355165
1,Sab ka malik ek.,3777,23133,../../NewData/narendramodi_comment_07_16_18_22.txt,17528,10155900094865165_10155902971615165
1,Aapka sath hamare liye suvidha janak hi hogahum ko aap par pura vishwash hain,3622,22227,../../NewData/narendramodi_comment_07_16_18_22.txt,16622,10155900094865165_10155903105845165
2,Modi Sab Pranam App bahut Achya kam kar rahe hai is kam me ham sab apke sath hai or meri apse vinti hai ki app apni tabiyat ka khayal rakiye app or app  jivo hajharo sal vande matram bharat mata ki jai,3617,22213,../../NewData/narendramodi_comment_07_16_18_22.txt,16608,10155900094865165_10155904558615165
1,Bahut aage le jayenge desh ko Janab Modi ji. Jaise desh me chunawi wada karne ke baad usko pura,3569,22122,../../NewData/narendramodi_comment_07_16_18_22.txt,16517,10155900094865165_10155906116135165
1,hindusthan ke sher ki jay ho,3438,21339,../../NewData/narendramodi_comment_07_16_18_22.txt,15734,10155900381255165_10155900394400165
0,Aagee  chaloo bhai Modi sahib..... Dushman ki  baath  na maaniyee.... laavoo  bahuth  kuch  Bharath keeliyee.,3376,21131,../../NewData/narendramodi_comment_07_16_18_22.txt,15526,10155900381255165_10155900432140165
0,Modi ji kale kuto Ka ilaj ker do bhut bimar hai,3412,21236,../../NewData/narendramodi_comment_07_16_18_22.txt,15631,10155900381255165_10155900443770165
2,Sir app ke jo soch he subko sath me leke chalna ek din ye soch appko itna upper lejayega chahe koye appko bhulne ki kosis kerenge to unnke samne appko bhulna nehi balki desh ko bhulna nazar aayega.,3425,21271,../../NewData/narendramodi_comment_07_16_18_22.txt,15666,10155900381255165_10155900449575165
1,Jai hind modi sir,3530,21917,../../NewData/narendramodi_comment_07_16_18_22.txt,16312,10155900381255165_10155900457650165
0,Kiu app  apne desh ki paisa ko kharab kar rahe ho..apne desh to ghum ke dekha nehi..aap chale dushre ki desh ghumne..koi vala kam aapse nehi hoga modi g..,3424,21269,../../NewData/narendramodi_comment_07_16_18_22.txt,15664,10155900381255165_10155900483010165
0,bahut ho gaya ghumna phirna. ab paani sar se upar jaa raha hai.,3515,21803,../../NewData/narendramodi_comment_07_16_18_22.txt,16198,10155900381255165_10155900519700165
1,Modi Ji hum aapke sath hain Vande matram,3372,21116,../../NewData/narendramodi_comment_07_16_18_22.txt,15511,10155900381255165_10155900532805165
1,kuch kam bi karaoge kiye ya gumne ka mja loge,3472,21580,../../NewData/narendramodi_comment_07_16_18_22.txt,15975,10155900381255165_10155900563515165
1,jai hind mera bharat mera hindusthan,3382,21155,../../NewData/narendramodi_comment_07_16_18_22.txt,15550,10155900381255165_10155900565700165
2,World best pm narendar modi Ji  mira bhart mahan,3361,21086,../../NewData/narendramodi_comment_07_16_18_22.txt,15481,10155900381255165_10155900616970165
2,Lageraho modiji pura des aapke sath he.,3497,21675,../../NewData/narendramodi_comment_07_16_18_22.txt,16070,10155900381255165_10155900655335165
1,Modiji is vishwa modiji,3496,21674,../../NewData/narendramodi_comment_07_16_18_22.txt,16069,10155900381255165_10155900655950165
2,"Sir ji you r great,Ap sirf bidesh Bhraman korenge ya Desh Ki bachhe ko v khayal rakhenge,Kitna garub hai hum log,Diya koro sahab",3402,21196,../../NewData/narendramodi_comment_07_16_18_22.txt,15591,10155900381255165_10155900727905165
1,Modejiko mera salam,3481,21607,../../NewData/narendramodi_comment_07_16_18_22.txt,16002,10155900381255165_10155900728470165
1,Adhar kard walo ko PSD milega sayed 2060 Sal me......,3453,21477,../../NewData/narendramodi_comment_07_16_18_22.txt,15872,10155900381255165_10155900766130165
1,Jiya ho modi jee 100sall,3509,21770,../../NewData/narendramodi_comment_07_16_18_22.txt,16165,10155900381255165_10155900777850165
2,PM ka samman..........mera samman....JAY HIND,3421,21264,../../NewData/narendramodi_comment_07_16_18_22.txt,15659,10155900381255165_10155900976355165
1,JAY JAY HO BHARAT,3550,22041,../../NewData/narendramodi_comment_07_16_18_22.txt,16436,10155900381255165_10155900977880165
1,Bharat anmol ratan,3542,22002,../../NewData/narendramodi_comment_07_16_18_22.txt,16397,10155900381255165_10155901154015165
1,Kya baat hai g,3444,21370,../../NewData/narendramodi_comment_07_16_18_22.txt,15765,10155900381255165_10155902272635165
2,nice  pic modi ji,3452,21475,../../NewData/narendramodi_comment_07_16_18_22.txt,15870,10155900381255165_10155902424155165
0,jaldi aa kar vyapam par kuch kijiye nahi 45 ke paar hattyayen pahuchne wali hai,3457,21510,../../NewData/narendramodi_comment_07_16_18_22.txt,15905,10155900381255165_10155902968360165
2,Salute you sir app bahut mehnat karte hai,3225,20325,../../NewData/narendramodi_comment_07_16_18_22.txt,14720,10155901018670165_10155901034730165
2,Congrats modi jee,3342,20977,../../NewData/narendramodi_comment_07_16_18_22.txt,15372,10155901018670165_10155901037335165
1,"Modi ji aap apna kaam kijiye, kisi ki baat ko mat suniye agar 5 baccho me se do bigad jaayen to bhi paalna to padta hi hai",3221,20297,../../NewData/narendramodi_comment_07_16_18_22.txt,14692,10155901018670165_10155901063175165
2,Sir hm sab digitial india ke platform pe chalna chahte hai.mai samghta ho kifirst priority hmre force ko hny chahiye becaymuse unhe sabse jyada digital hona must hai india ke liye.,3187,20184,../../NewData/narendramodi_comment_07_16_18_22.txt,14579,10155901018670165_10155901079300165
1,MODI -SHER E HIND,3231,20355,../../NewData/narendramodi_comment_07_16_18_22.txt,14750,10155901018670165_10155901090765165
1,Aesa nahi lagta ab bahot ho gaya..!Aavo ab lout chale....,3247,20474,../../NewData/narendramodi_comment_07_16_18_22.txt,14869,10155901018670165_10155901125910165
2,Wah modi sab,3330,20867,../../NewData/narendramodi_comment_07_16_18_22.txt,15262,10155901018670165_10155901147970165
1,Congress ke time me jaisa tha vaisa hi chal raha he abhibhi,3185,20170,../../NewData/narendramodi_comment_07_16_18_22.txt,14565,10155901018670165_10155901188855165
1,Kyoki hum chup h,3269,20604,../../NewData/narendramodi_comment_07_16_18_22.txt,14999,10155901018670165_10155901197540165
2,grt  step 4grt relation...nic  job  sir,3242,20452,../../NewData/narendramodi_comment_07_16_18_22.txt,14847,10155901018670165_10155901244595165
0,Kuch nahi karoge tum india ke liye,3209,20240,../../NewData/narendramodi_comment_07_16_18_22.txt,14635,10155901018670165_10155901249810165
1,Addd mee frnds,3354,21055,../../NewData/narendramodi_comment_07_16_18_22.txt,15450,10155901018670165_10155901293295165
1,jaha bhi jate hai aap waha apne piche ej naye bharat ki tasvir ban jaati hai ....thanku modi ji....,3301,20752,../../NewData/narendramodi_comment_07_16_18_22.txt,15147,10155901018670165_10155901298520165
2,Jab tak suraj chaand rahega modi ji ka naam rahega,3174,20126,../../NewData/narendramodi_comment_07_16_18_22.txt,14521,10155901018670165_10155901310065165
1,Modi jee aapka tourist visa ka validity kab tak hai....,3213,20250,../../NewData/narendramodi_comment_07_16_18_22.txt,14645,10155901018670165_10155901999460165
2,Unstoppable modi sir,3279,20665,../../NewData/narendramodi_comment_07_16_18_22.txt,15060,10155901018670165_10155902144290165
0,Jada ghumte mat raho  hamlok ko madat karo hamar bare socho jara  ham madat  magte  to mili nahi qq,3295,20727,../../NewData/narendramodi_comment_07_16_18_22.txt,15122,10155901018670165_10155902212880165
0,Modiji apne desh ka tho khayal rakho sirf gumne ke pm bane ho kiya falthi pm hai,3294,20725,../../NewData/narendramodi_comment_07_16_18_22.txt,15120,10155901018670165_10155902275805165
2,Modi ji ek aisa star hai wo jaroor India ka star badlega  kya khete ho mera bhayio or bheno,3179,20149,../../NewData/narendramodi_comment_07_16_18_22.txt,14544,10155901018670165_10155902344805165
1,Modi ji namashkarSorry to say but aap jab v kahin Facebook pe kuch share karte hain to status ko English me update karte hai...Khusi hogi jab aaapka updates  hindi me,3211,20243,../../NewData/narendramodi_comment_07_16_18_22.txt,14638,10155901018670165_10155902564375165
1,Jai hind ks.chouhan bhinmal jalore,3307,20768,../../NewData/narendramodi_comment_07_16_18_22.txt,15163,10155901018670165_10155902571905165
1,Duniya ki technology lane par hi dess ka vikas hoga,3173,20125,../../NewData/narendramodi_comment_07_16_18_22.txt,14520,10155901018670165_10155902783370165
1,acchae din kab ayengey,3338,20929,../../NewData/narendramodi_comment_07_16_18_22.txt,15324,10155901018670165_10155902805685165
1,Prnam ji kuch desh ke liye mai bhi krna chahta hu bas aapka thoda sath chahiye agar mil jaye to mera kaam aasan or khubshurat hmara desh hoga.,3194,20200,../../NewData/narendramodi_comment_07_16_18_22.txt,14595,10155901018670165_10155902992090165
0,Faltu time nahi hai,3319,20809,../../NewData/narendramodi_comment_07_16_18_22.txt,15204,10155901018670165_10155903038450165
1,Apne desh ke kone bhi dekh lo modi ji,3166,20096,../../NewData/narendramodi_comment_07_16_18_22.txt,14491,10155901018670165_10155903121560165
0,Sir aap to India KO bhul gye or gov k paiso PR holiday PR ghum rhe ho aap India me toh dikhai hi nai dete,3177,20144,../../NewData/narendramodi_comment_07_16_18_22.txt,14539,10155901018670165_10155903424315165
1,Hello modi ji,3254,20537,../../NewData/narendramodi_comment_07_16_18_22.txt,14932,10155901018670165_10155903873625165
2,app desh ka dadkhan jaihind,3316,20795,../../NewData/narendramodi_comment_07_16_18_22.txt,15190,10155901018670165_10155903902230165
2,Bhakt se bada anuyai hota hai.,3313,20788,../../NewData/narendramodi_comment_07_16_18_22.txt,15183,10155901018670165_10155905272445165
2,Modi ji hamara hindustan ka naam saada ucha rakhna.jai bharat mata jai hind..,3048,19585,../../NewData/narendramodi_comment_07_16_18_22.txt,13980,10155903070795165_10155903076310165
1,modi+ji namastay aap hamaray das ki aakhri umed h,3076,19653,../../NewData/narendramodi_comment_07_16_18_22.txt,14048,10155903070795165_10155903085080165
1,Aap.badhte.jao.sir.ji,3090,19686,../../NewData/narendramodi_comment_07_16_18_22.txt,14081,10155903070795165_10155903097970165
1,Modiji aap hmesa india first ko dhyan me rkhkr hi faisle lena. Waise hme aap pr viswas hai is viswas ko tutne mt dena,3107,19786,../../NewData/narendramodi_comment_07_16_18_22.txt,14181,10155903070795165_10155903137890165
1,Namsthe sir  jai gurudhev,3092,19699,../../NewData/narendramodi_comment_07_16_18_22.txt,14094,10155903070795165_10155903158690165
2,j banda kam kar raha hai ham maze le rahe hai jab sey india ke pm bane hai tab sey laga gai great man in the world .........best pm in the world.....  only one on one......,3122,19850,../../NewData/narendramodi_comment_07_16_18_22.txt,14245,10155903070795165_10155903420960165
1,Modi Ji. App mearaku thoda call krdejia. 0096555218960,3054,19601,../../NewData/narendramodi_comment_07_16_18_22.txt,13996,10155903070795165_10155903487375165
1,Jai modi raaj,3101,19755,../../NewData/narendramodi_comment_07_16_18_22.txt,14150,10155903070795165_10155903507795165
1,Is desh ko jarurat h guidelines ki Varna itani jayada aabadi ka desh world no.1 nahi ho sakta.jo vikas ke raste mai aata hai. Usko hamesha ke liye khatam kar do. Chahe wo koi party ho ya galat insan desh ko tarakki chahiye kisi bhi keemat par.,3115,19820,../../NewData/narendramodi_comment_07_16_18_22.txt,14215,10155903070795165_10155905161940165
2,Lage raho sir.,3133,19885,../../NewData/narendramodi_comment_07_16_18_22.txt,14280,10155903070795165_10155906115065165
2,"Sir, Namaskar. Mai Bihar se hun aur aapka jabardash prasansak hu, Aap jo desh ke liye niswarth bav se kam kar rahe hai,  aapko sadaib best p.m ke roop me jana jaega. salute to you sir.",3131,19877,../../NewData/narendramodi_comment_07_16_18_22.txt,14272,10155903070795165_10155907179325165
1,Sorry sir shayd tum ko nahin maloom. Meri dadi bhi aisa carpet bunti hai uski koi value nahin. Sorry i forgot she is in india,3043,19535,../../NewData/narendramodi_comment_07_16_18_22.txt,13930,10155903073430165_10155903104685165
1,Very nice  jai bgart   jai shiri modi g,3018,19317,../../NewData/narendramodi_comment_07_16_18_22.txt,13712,10155903073430165_10155903144110165
1,Humari sabhayata humari pehchaan...,3023,19336,../../NewData/narendramodi_comment_07_16_18_22.txt,13731,10155903073430165_10155903310075165
2,Maza to tab hai jab kohinoor wapis lao,3046,19575,../../NewData/narendramodi_comment_07_16_18_22.txt,13970,10155903073430165_10155904176855165
2,ache log ko ache gifts hi milte hain jaise indians ko aap mila sir ji.,3044,19550,../../NewData/narendramodi_comment_07_16_18_22.txt,13945,10155903073430165_10155906108090165
1,sir..only tour karenge..jara desh ki bekaari ke bare me kuch kijiye..bihar mai election hai kuch sochiye,2981,19026,../../NewData/narendramodi_comment_07_16_18_22.txt,13421,10155903076865165_10155903087345165
1,Modi : mera visa dene ke liye thank u. Kitna chahiye?,3008,19160,../../NewData/narendramodi_comment_07_16_18_22.txt,13555,10155903076865165_10155903117140165
2,Respected sir aap aaj pure Bharat ki ummid ho ...ek naya savera aapne hi janta ko dikhaya he...ap dhup bhi nikaliye...,2958,18879,../../NewData/narendramodi_comment_07_16_18_22.txt,13274,10155903076865165_10155903315785165
1,Onli modi sarkar,3002,19137,../../NewData/narendramodi_comment_07_16_18_22.txt,13532,10155903076865165_10155903321595165
0,Modi ji apne ye to kaha diya ki Jo saksham hai vo subsiti na le Main sahamat hoo per please Ek bar himmat juta ker bol dijiye Jo saksham hai vo arakshan na le,2964,18915,../../NewData/narendramodi_comment_07_16_18_22.txt,13310,10155903076865165_10155903475965165
2,jai ho modi jii,3010,19175,../../NewData/narendramodi_comment_07_16_18_22.txt,13570,10155903076865165_10155903506705165
1,inpoten meet naranthiramody,2999,19115,../../NewData/narendramodi_comment_07_16_18_22.txt,13510,10155903076865165_10155905831110165
