1,bhai eid ka gift nhi doge,27143,109045,../../NewData/BeingSalmanKhan_comment_07_17_18_03.txt,71036,879829985438539_880388668716004
0,agar sachhe muslman ho to eid ke din is kutte ki film mat dekhna.,27145,109049,../../NewData/BeingSalmanKhan_comment_07_17_18_03.txt,71040,879829985438539_880389165382621
1,Yehi sahi waqt hai jab hamara imaan azmaaya jayega,27152,109076,../../NewData/BeingSalmanKhan_comment_07_17_18_03.txt,71067,879829985438539_880399808714890
0,Kafir ki aulad mai teri movi nhi dekhunga....,27154,109080,../../NewData/BeingSalmanKhan_comment_07_17_18_03.txt,71071,879829985438539_880400818714789
1,waise bhi bete hm bs yaha ana bs kam kiye hai warna hm aksar yahi raha karte the,27159,109087,../../NewData/BeingSalmanKhan_comment_07_17_18_03.txt,71078,879829985438539_880401988714672
1,Salman bhai mujhe bhi aana hai,27160,109089,../../NewData/BeingSalmanKhan_comment_07_17_18_03.txt,71080,879829985438539_880402192047985
1,wÖise tu boli nai ki hai kaha se,27173,109131,../../NewData/BeingSalmanKhan_comment_07_17_18_03.txt,71122,879829985438539_880405212047683
1,Aap ka bhi insaf honga. yaha nahi to waha honga. . inshallha,27176,109138,../../NewData/BeingSalmanKhan_comment_07_17_18_03.txt,71129,879829985438539_880405462047658
0,sandhya slman bat nai karega,27178,109140,../../NewData/BeingSalmanKhan_comment_07_17_18_03.txt,71131,879829985438539_880405515380986
0,Alisha sallu hat ni aane vala the sapne dekhna band karo,27184,109159,../../NewData/BeingSalmanKhan_comment_07_17_18_03.txt,71150,879829985438539_880408395380698
1,I don't like salman i like islam,27185,109160,../../NewData/BeingSalmanKhan_comment_07_17_18_03.txt,71151,879829985438539_880408482047356
0,Or me bhi indian hu kon hota he ye jo musalman ko gali de or khud ko musalman kehta he jaheel,27187,109164,../../NewData/BeingSalmanKhan_comment_07_17_18_03.txt,71155,879829985438539_880408818713989
0,yeh chutye ko leker jaker bathroom mein bandh karo re,27188,109165,../../NewData/BeingSalmanKhan_comment_07_17_18_03.txt,71156,879829985438539_880408858713985
2,sallu is bst,27190,109168,../../NewData/BeingSalmanKhan_comment_07_17_18_03.txt,71159,879829985438539_880408948713976
2,Taiyar hai bhai jan,27191,109169,../../NewData/BeingSalmanKhan_comment_07_17_18_03.txt,71160,879829985438539_880408995380638
0,Salman muzhe mere sawal ka jawab cahiye hum nich to tu kon akher tu bhi muslim h na most reply,27196,109184,../../NewData/BeingSalmanKhan_comment_07_17_18_03.txt,71175,879829985438539_880410785380459
0,Nich musalman kis ko bola pehle apne aap ko dekh tu aaj jaha par hai un musamano ki vajah se hai. Samga.hamko dhamki deta hai kon dekhna chahega ye sadi movie,27198,109189,../../NewData/BeingSalmanKhan_comment_07_17_18_03.txt,71180,879829985438539_880411858713685
1,Weat karna padega,27201,109193,../../NewData/BeingSalmanKhan_comment_07_17_18_03.txt,71184,879829985438539_880412698713601
2,Ap sache wale being human ho bus apki yahi bt sabse Alag h...ap Surat se kuch Jada smart nhi PR dil se ess pure Bollywood m sundar ho....saf pakk dil h apke pass Jo etni dou,27203,109200,../../NewData/BeingSalmanKhan_comment_07_17_18_03.txt,71191,879829985438539_880413785380159
0,Agar ek Muslim hoker iman ke saath gaddari kartha hai use support karnewala usse bada kuffar koyee nahi .pahale unku dawath do jo us darinda ko support kartha ho kaho ki Islam kya,27204,109202,../../NewData/BeingSalmanKhan_comment_07_17_18_03.txt,71193,879829985438539_880413895380148
1,bahut pyaar h aap nhi samjhoge,27206,109206,../../NewData/BeingSalmanKhan_comment_07_17_18_03.txt,71197,879829985438539_880415032046701
1,Abhi easvariya ka bhut utra hi ni he to tumko kaha se milega,27217,109228,../../NewData/BeingSalmanKhan_comment_07_17_18_03.txt,71219,879829985438539_880424168712454
2,Tu dil hai tu jaan hai..mera salman hai,27221,109239,../../NewData/BeingSalmanKhan_comment_07_17_18_03.txt,71230,879829985438539_880427525378785
0,o ja gashti k bachey musalman ho k hindu bna hai lanat tere pe,27223,109241,../../NewData/BeingSalmanKhan_comment_07_17_18_03.txt,71232,879829985438539_880427575378780
1,Teri party tujhe hi mubarak humare liye Allah hi kaafi h,27228,109251,../../NewData/BeingSalmanKhan_comment_07_17_18_03.txt,71242,879829985438539_880429285378609
1,Zindgibhar ka sath chahiye..apka Salman Sahab marry me..,27232,109263,../../NewData/BeingSalmanKhan_comment_07_17_18_03.txt,71254,879829985438539_880432445378293
0,mai chahthi hu kya ki bajrangi bhaijaan film flap hona pukka,27235,109270,../../NewData/BeingSalmanKhan_comment_07_17_18_03.txt,71261,879829985438539_880433202044884
0,Bajarangi film flop  hogiii       salman ki. Maaa bahen hoo  gii      saaaalaaaa chotiya,27239,109290,../../NewData/BeingSalmanKhan_comment_07_17_18_03.txt,71281,879829985438539_880440162044188
2,aabki baat  800cr par bajrangi bhaijaan (y),27245,109303,../../NewData/BeingSalmanKhan_comment_07_17_18_03.txt,71294,879829985438539_880444482043756
2,awsome song bhaijan...,27246,109307,../../NewData/BeingSalmanKhan_comment_07_17_18_03.txt,71298,879829985438539_880445295377008
0,Tu dega hi nahi mere bhaay,27247,109314,../../NewData/BeingSalmanKhan_comment_07_17_18_03.txt,71305,879829985438539_880448645376673
2,"yes, lv u sallu bhaijaan...",27265,109385,../../NewData/BeingSalmanKhan_comment_07_17_18_03.txt,71376,879829985438539_880506002037604
1,Sir ji apni kise s wada keya hi,27269,109402,../../NewData/BeingSalmanKhan_comment_07_17_18_03.txt,71393,879829985438539_880544842033720
0,Lanat ho bajrangi shaitan par lanti slman,27274,109424,../../NewData/BeingSalmanKhan_comment_07_17_18_03.txt,71415,879829985438539_880569022031302
1,hume bhi party chahiye,27275,109425,../../NewData/BeingSalmanKhan_comment_07_17_18_03.txt,71416,879829985438539_880570138697857
1,Jabar dast bhai,27276,109427,../../NewData/BeingSalmanKhan_comment_07_17_18_03.txt,71418,879829985438539_880571565364381
0,flop movie kutta salman,27281,109437,../../NewData/BeingSalmanKhan_comment_07_17_18_03.txt,71428,879829985438539_880574798697391
2,Yes I'm ready u luk so handsome bhagwaan aapko buri nazar se bachaaye,27287,109448,../../NewData/BeingSalmanKhan_comment_07_17_18_03.txt,71439,879829985438539_880577032030501
1,Bhai kasam se mein ape se milna chahta hoon per main switzerlamd mein rehta hol im sorry bhai   Nahi aa sakhta. Per inshahhal zindagi mein ape se ek dafaa milne aaoon ga Dua go. Aslam Hayat Hayat,27289,109450,../../NewData/BeingSalmanKhan_comment_07_17_18_03.txt,71441,879829985438539_880577525363785
0,salman tujhe to alha ka brkt h ..jo tme kharab bole uske ghrme jurjate h ( thats means haram khor ka khandan ) ok,27291,109456,../../NewData/BeingSalmanKhan_comment_07_17_18_03.txt,71447,879829985438539_880579642030240
1,Eid kab hain? Jis din Salman ki filim release hoti hai.,27292,109458,../../NewData/BeingSalmanKhan_comment_07_17_18_03.txt,71449,879829985438539_880579912030213
1,Apki movie dekhne jrur jayenge salman ji. Love u. . .,27306,109508,../../NewData/BeingSalmanKhan_comment_07_17_18_03.txt,71499,879829985438539_880601595361378
1,voh toh haiiiiii,27309,109515,../../NewData/BeingSalmanKhan_comment_07_17_18_03.txt,71506,879829985438539_880608988693972
2,"Ied mubarak ho salmaan g.khuda se dua hai,aapki ye movie bhi badi hit ho,aapki last movis ki tarah.",27312,109529,../../NewData/BeingSalmanKhan_comment_07_17_18_03.txt,71520,879829985438539_880615698693301
1,Apki movie me sbko bolna hai jai siya ram tab eed manegi acchi...,27314,109533,../../NewData/BeingSalmanKhan_comment_07_17_18_03.txt,71524,879829985438539_880616832026521
2,bhai jaan jaisa koi nhi mai super man bhai jaan ka fan.,27322,109559,../../NewData/BeingSalmanKhan_comment_07_17_18_03.txt,71550,879829985438539_880645215357016
0,Eid ke din salman apni maiya chudae,27327,109587,../../NewData/BeingSalmanKhan_comment_07_17_18_03.txt,71578,879829985438539_880656672022537
1,sabki jaan salman khan.,27333,109604,../../NewData/BeingSalmanKhan_comment_07_17_18_03.txt,71595,879829985438539_880669738687897
0,Nahi to ye mat soch ke tu fanna nahi hoga ye khyal tera jhutha h,27341,109635,../../NewData/BeingSalmanKhan_comment_07_17_18_03.txt,71626,879829985438539_880678092020395
1,jai jai bajarangbali bhai bhulna mat seme party,27344,109648,../../NewData/BeingSalmanKhan_comment_07_17_18_03.txt,71639,879829985438539_880688835352654
1,Ha bhai salam,27352,109664,../../NewData/BeingSalmanKhan_comment_07_17_18_03.txt,71655,879829985438539_880699035351634
2,my sallu bro always mindblowing salam sallu bhai,27355,109672,../../NewData/BeingSalmanKhan_comment_07_17_18_03.txt,71663,879829985438539_880706085350929
1,Salman ap bohoot pyary lag rahy ho kasam say . ak bat bolon,27358,109681,../../NewData/BeingSalmanKhan_comment_07_17_18_03.txt,71672,879829985438539_880709145350623
1,iss bar eid ki party bhai ki tarf se...........,27361,109688,../../NewData/BeingSalmanKhan_comment_07_17_18_03.txt,71679,879829985438539_880711745350363
1,M aapko mis kar rha bhaiya kab aayega big boss plz reply karna,27363,109691,../../NewData/BeingSalmanKhan_comment_07_17_18_03.txt,71682,879829985438539_880712828683588
1,Wowww maza aye gaa :*,27369,109707,../../NewData/BeingSalmanKhan_comment_07_17_18_03.txt,71698,879829985438539_880730368681834
0,Salman Khan Teri film flop jayegi tu musalman nhi h tu kafir h,27374,109725,../../NewData/BeingSalmanKhan_comment_07_17_18_03.txt,71716,879829985438539_880761528678718
2,Don't wary always be happy insaallhatala aap ke film sb se jada box office me kamane wale film hoge,27379,109743,../../NewData/BeingSalmanKhan_comment_07_17_18_03.txt,71734,879829985438539_880780088676862
2,Amazngggggg bhaijaan.... Love uuuuh koi kuch ke le mai toh 1 st day 1 show jaunga....,27384,109761,../../NewData/BeingSalmanKhan_comment_07_17_18_03.txt,71752,879829985438539_880809578673913
1,salman khan ek achhe enshan hai mere bhai hai,27398,109781,../../NewData/BeingSalmanKhan_comment_07_17_18_03.txt,71772,879829985438539_880826775338860
0,Ab kis baat bheek mang rha rha hath faila kr eid pr,27400,109786,../../NewData/BeingSalmanKhan_comment_07_17_18_03.txt,71777,879829985438539_880836588671212
1,eid mubarak bhaijaan in advance,27404,109815,../../NewData/BeingSalmanKhan_comment_07_17_18_03.txt,71806,879829985438539_880885198666351
1,Kiya baat hai,27405,109817,../../NewData/BeingSalmanKhan_comment_07_17_18_03.txt,71808,879829985438539_880890235332514
1,Party to tab hogi jab life mein pretty hogi and pretty life hogi and pretty hi my beloved wife hogi,27407,109821,../../NewData/BeingSalmanKhan_comment_07_17_18_03.txt,71812,879829985438539_880893558665515
0,kamina salman yehi bolna chare ho na maqsood bhai,27409,109825,../../NewData/BeingSalmanKhan_comment_07_17_18_03.txt,71816,879829985438539_880895625331975
1,Pirty toh aap k sath karni thi boss,27410,109827,../../NewData/BeingSalmanKhan_comment_07_17_18_03.txt,71818,879829985438539_880895918665279
2,kmaal krte ho paande ji...,27413,109835,../../NewData/BeingSalmanKhan_comment_07_17_18_03.txt,71826,879829985438539_880904651997739
2,ramzaan or eid mubbark ho salman bhai 8863960135 mai aap ka wait,27421,109848,../../NewData/BeingSalmanKhan_comment_07_17_18_03.txt,71839,879829985438539_880918528663018
1,Hum to hamesa tayaar rehte hain....bas aapki aane ki deri hoti hai.......;-),27425,109853,../../NewData/BeingSalmanKhan_comment_07_17_18_03.txt,71844,879829985438539_880919941996210
1,oui salman khan,27427,109856,../../NewData/BeingSalmanKhan_comment_07_17_18_03.txt,71847,879829985438539_880920998662771
1,aap Kavi hamare orissa me to aao,27430,109862,../../NewData/BeingSalmanKhan_comment_07_17_18_03.txt,71853,879829985438539_880927978662073
2,salman bhai main apka bahut bada fan hu mujhe apki bahut pasand aata hain.,27431,109863,../../NewData/BeingSalmanKhan_comment_07_17_18_03.txt,71854,879829985438539_880928815328656
2,i love u saiman ji main apka bohat bada fan hon sir mujhe aap par pora brosha hai aap mujhe back msg karo ge main aap se jab melunga na main apko acting dekhaoonga,27437,109876,../../NewData/BeingSalmanKhan_comment_07_17_18_03.txt,71867,879829985438539_880942761993928
2,sallu bhai ilove you,27439,109880,../../NewData/BeingSalmanKhan_comment_07_17_18_03.txt,71871,879829985438539_880944705327067
1,Bhai tyohaar to bhai ka hai tou wo humara hua na,27449,109916,../../NewData/BeingSalmanKhan_comment_07_17_18_03.txt,71907,879829985438539_880973898657481
0,Salman tum baishram ho pahlai Nam ka Matlab janlo pir samjo gai,27456,109964,../../NewData/BeingSalmanKhan_comment_07_17_18_03.txt,71955,879829985438539_880992378655633
0,Warna tumhari khairnah ha or waisabi eid to abi nahi hai kuch Dino baad hai,27462,109981,../../NewData/BeingSalmanKhan_comment_07_17_18_03.txt,71972,879829985438539_880996691988535
0,Tum nai had par Kardiya salman khan,27463,109982,../../NewData/BeingSalmanKhan_comment_07_17_18_03.txt,71973,879829985438539_880997565321781
0,Sahi roosdar ki eid hoti h acting walk k nahe,27470,110000,../../NewData/BeingSalmanKhan_comment_07_17_18_03.txt,71991,879829985438539_881002535321284
1,Sir me apka big big fan hu mujy apse call pe bt karni hai ek bar sir mera contact num 03356507139 Skype I.d abdul.rehman6731 plzzzz contact meabdul.rehman.sahabto,27475,110019,../../NewData/BeingSalmanKhan_comment_07_17_18_03.txt,72010,879829985438539_881009701987234
1,Bhai logo sbse bda dharm insaniyat usko follow karo,27480,110027,../../NewData/BeingSalmanKhan_comment_07_17_18_03.txt,72018,879829985438539_881013181986886
0,Iss bar BJP ka kutta Muslim pe dhabba aanne wala hai eid k din jaha b ye kutta aayega jute mar k bhagao sale k ghar me ghusu,27483,110034,../../NewData/BeingSalmanKhan_comment_07_17_18_03.txt,72025,879829985438539_881015031986701
0,Ye koun kutta bola,27487,110044,../../NewData/BeingSalmanKhan_comment_07_17_18_03.txt,72035,879829985438539_881016118653259
1,Yahi to sab log chahte hain ki hum lade aur tum log vohi kr rhe ho,27488,110047,../../NewData/BeingSalmanKhan_comment_07_17_18_03.txt,72038,879829985438539_881016538653217
0,Salmanics ignore kro inko ye sb srgay fan,27490,110050,../../NewData/BeingSalmanKhan_comment_07_17_18_03.txt,72041,879829985438539_881017048653166
0,Ashu Singh tu kya janta hai,27497,110058,../../NewData/BeingSalmanKhan_comment_07_17_18_03.txt,72049,879829985438539_881017591986445
1,Ashu yar bs kro. . .,27506,110074,../../NewData/BeingSalmanKhan_comment_07_17_18_03.txt,72065,879829985438539_881018471986357
0,Ashu Singh pahlai write siko pir liko q k tumhari bat hamai samag mai nahi ati,27514,110092,../../NewData/BeingSalmanKhan_comment_07_17_18_03.txt,72083,879829985438539_881020418652829
0,Pk?????......agar bhagwan ko pujne ke liye ek chhoti si murti ki jarurat ni hai to tum bahanchod hizdo ko itne bade maszid ki kya jarurat hoti hai DHILE LAND KI PAIDAISHO???,27519,110098,../../NewData/BeingSalmanKhan_comment_07_17_18_03.txt,72089,879829985438539_881021028652768
0,Abdul raheem bhai iske nhi samajh aayga mu bhat hai sala maners to hai hi nhi isme isko samjhan khde ke aage been bajana hai,27521,110102,../../NewData/BeingSalmanKhan_comment_07_17_18_03.txt,72093,879829985438539_881021711986033
1,Ashu Sing tumhari saat howa hoga tum logo ka Mandira mai haaaaaaaaa,27525,110109,../../NewData/BeingSalmanKhan_comment_07_17_18_03.txt,72100,879829985438539_881023065319231
1,Bhupender Panwar ab tum mojsai q poch rahai ho ka mai Kon ho,27532,110123,../../NewData/BeingSalmanKhan_comment_07_17_18_03.txt,72114,879829985438539_881024458652425
0,Yar ashu tm had par kr rhe ho. Plz bs kr yr. . .itna nonsense mt bolo,27536,110128,../../NewData/BeingSalmanKhan_comment_07_17_18_03.txt,72119,879829985438539_881025205319017
0,Ashu Singh tumhari baat hamai samag nahi arahi,27538,110131,../../NewData/BeingSalmanKhan_comment_07_17_18_03.txt,72122,879829985438539_881026408652230
0,Abhi tak to bada dum tha tum logo ke laudo me??????? achanak se dhile ho gaye????,27546,110145,../../NewData/BeingSalmanKhan_comment_07_17_18_03.txt,72136,879829985438539_881027878652083
1,@bhupendra panwar...tu pakistan kyu ni chala jata 5 saal k liye..?,27560,110174,../../NewData/BeingSalmanKhan_comment_07_17_18_03.txt,72165,879829985438539_881033371984867
0,Abey pakistaan ja kutte teri to hindi bhi sahi ni hai,27564,110180,../../NewData/BeingSalmanKhan_comment_07_17_18_03.txt,72171,879829985438539_881034168651454
0,aur har bhade ke tattuo se comment karwane wala har SALMAN KHAN musalmaan hota hai,27573,110192,../../NewData/BeingSalmanKhan_comment_07_17_18_03.txt,72183,879829985438539_881038841984320
0,to tera matlb har bura kam karne vala aadmi musalman hota h Great thinking h bhai   my midle finger salute u,27574,110193,../../NewData/BeingSalmanKhan_comment_07_17_18_03.txt,72184,879829985438539_881039285317609
0,Izat ki bt raas ni ati hai na,27585,110214,../../NewData/BeingSalmanKhan_comment_07_17_18_03.txt,72205,879829985438539_881050461983158
0,party ke liye log to ready the par tumne link hi nahi diya shirf puch kar bhul gae,27587,110217,../../NewData/BeingSalmanKhan_comment_07_17_18_03.txt,72208,879829985438539_881053175316220
0,Aur jo chup chup ke bole  chala jay vo hi asli hijde ki aulad hota hai ashu kutt,27600,110247,../../NewData/BeingSalmanKhan_comment_07_17_18_03.txt,72238,879829985438539_881112228643648
0,sonya khan ek hijda musalmaan hai isey apna gender ni pata,27602,110253,../../NewData/BeingSalmanKhan_comment_07_17_18_03.txt,72244,879829985438539_881116868643184
1,Sonya tum ladka ho ya ldki jaldi btao ek kam h  tum se,27608,110262,../../NewData/BeingSalmanKhan_comment_07_17_18_03.txt,72253,879829985438539_881119798642891
0,"Musalmaan kabhi aage se vaar ni karta hamesha hijdo ki tarah pichhe se vaar karta hai,Pakistan ko hi dekh lo Muslim hijdo ka desh Hahahahahahaha",27611,110268,../../NewData/BeingSalmanKhan_comment_07_17_18_03.txt,72259,879829985438539_881123081975896
0,bhupender panwar hijda musalmaan hai,27616,110277,../../NewData/BeingSalmanKhan_comment_07_17_18_03.txt,72268,879829985438539_881124948642376
0,Rahi baat karnai ki to manai salman sai bat ki Naka in ka chamcho sai,27620,110285,../../NewData/BeingSalmanKhan_comment_07_17_18_03.txt,72276,879829985438539_881125898642281
0,Bhupender bro sahi keh rhe ho isse bada chtiya mene apni zindagi mai nhi dekha yahi hai chutiya no1,27630,110299,../../NewData/BeingSalmanKhan_comment_07_17_18_03.txt,72290,879829985438539_881133635308174
1,Advenced idd mubarak,27634,110305,../../NewData/BeingSalmanKhan_comment_07_17_18_03.txt,72296,879829985438539_881142861973918
1,is bar eid pe hoga new dhamaka salman bhai jaan ka,27642,110328,../../NewData/BeingSalmanKhan_comment_07_17_18_03.txt,72319,879829985438539_881169128637958
1,Aaj ki parti salman bhai ki eid ki parti,27649,110352,../../NewData/BeingSalmanKhan_comment_07_17_18_03.txt,72343,879829985438539_881189098635961
1,Uske baad last mai apne liye kuch lelungi,27658,110383,../../NewData/BeingSalmanKhan_comment_07_17_18_03.txt,72374,879829985438539_881214721966732
1,Gracy Singh or salaman khan jodi  ek sath dekhana chahata hu,27660,110385,../../NewData/BeingSalmanKhan_comment_07_17_18_03.txt,72376,879829985438539_881214811966723
1,Aur sab kaisa chalra hai,27661,110387,../../NewData/BeingSalmanKhan_comment_07_17_18_03.txt,72378,879829985438539_881215165300021
2,love uuuu shalluuuu,27663,110391,../../NewData/BeingSalmanKhan_comment_07_17_18_03.txt,72382,879829985438539_881215798633291
0,I hate bajarngi bhai jaan. .. Salman,27668,110411,../../NewData/BeingSalmanKhan_comment_07_17_18_03.txt,72402,879829985438539_881236925297845
1,Tum mere jaan ho bhai plz 1 bar  call ya msg tu h to bola tha like ya comment karo tum padty ho na .,27669,110412,../../NewData/BeingSalmanKhan_comment_07_17_18_03.txt,72403,879829985438539_881237351964469
0,A harami hai iski bhadwa ki mov mat dekna,27677,110439,../../NewData/BeingSalmanKhan_comment_07_17_18_03.txt,72430,879829985438539_881313511956853
0,kisi ko harami kahne se pahle apne bare me soco.,27678,110440,../../NewData/BeingSalmanKhan_comment_07_17_18_03.txt,72431,879829985438539_881315628623308
0,Salman khan Bajrangi kutta maa ka lauda bhenchod,27685,110454,../../NewData/BeingSalmanKhan_comment_07_17_18_03.txt,72445,879829985438539_881366831951521
2,Sal man khan heis tha bole od king  camen song bajrange vayjan vay jan to hamare pas hamesa vay jan rahe ga,27686,110456,../../NewData/BeingSalmanKhan_comment_07_17_18_03.txt,72447,879829985438539_881372158617655
1,I think vai app padhtey hongey plzz mai appse milna chata hu,27690,110469,../../NewData/BeingSalmanKhan_comment_07_17_18_03.txt,72460,879829985438539_881387918616079
1,Koi mere se zyada bda sallu ka fan hai to to lagatar iss film k pahle show dekhega koi hai to add me,27693,110473,../../NewData/BeingSalmanKhan_comment_07_17_18_03.txt,72464,879829985438539_881388771949327
0,salman bhai apna aisa q kaha ki Musalman o ko apki film dakne ki zaroorat nhi hai....:(,27697,110498,../../NewData/BeingSalmanKhan_comment_07_17_18_03.txt,72489,879829985438539_881522801935924
1,"Akhir show me apko kitne din tak dekte rahungi,?",27703,110515,../../NewData/BeingSalmanKhan_comment_07_17_18_03.txt,72506,879829985438539_881556418599229
0,jisko film ni dekhni mat dekho bhonko mat yaha aake pagal kutte ki tarah  apna kam karo haters,27707,110521,../../NewData/BeingSalmanKhan_comment_07_17_18_03.txt,72512,879829985438539_881560348598836
0,bhai is kutte ki film mat dekho kyu apna paisa haram jagah le jaa rahe ho,27713,110542,../../NewData/BeingSalmanKhan_comment_07_17_18_03.txt,72533,879829985438539_881573515264186
1,Hanji paji tiaar aa jooba,27714,110545,../../NewData/BeingSalmanKhan_comment_07_17_18_03.txt,72536,879829985438539_881578445263693
1,Bhai mujhe aapke sath acting karni hai main bhai aapke ghar ka kaam bhi kar doonga bhai mujhko mumbai le chalo bhai  bhai plz bhai,27721,110559,../../NewData/BeingSalmanKhan_comment_07_17_18_03.txt,72550,879829985438539_881606055260932
1,bhai ap ka bohat bara fan ho add karo mujay plz,27728,110583,../../NewData/BeingSalmanKhan_comment_07_17_18_03.txt,72574,879829985438539_881625928592278
1,tumne muje msg kya tha plz batao please,27733,110597,../../NewData/BeingSalmanKhan_comment_07_17_18_03.txt,72588,879829985438539_881643281923876
0,Alisha apni shakl dikhao plz hehehe salman khan ko pagal kutte ne kata hai jo vo tumhe call krega,27734,110602,../../NewData/BeingSalmanKhan_comment_07_17_18_03.txt,72593,879829985438539_881644658590405
0,pure bachio ki jaan lena hai kya aise pics dekha k,27740,110620,../../NewData/BeingSalmanKhan_comment_07_17_18_03.txt,72611,879829985438539_881654461922758
1,main ye pic dekhne ke liye taiyar hu salman bhai,27744,110632,../../NewData/BeingSalmanKhan_comment_07_17_18_03.txt,72623,879829985438539_881663778588493
1,salmaan sr...... Aap ne khud kaha k aap hr cmments khud read krte ho..... so kabhi reply ku nahi krte,27748,110650,../../NewData/BeingSalmanKhan_comment_07_17_18_03.txt,72641,879829985438539_881683925253145
2,love uuu shallluuuuu,27752,110656,../../NewData/BeingSalmanKhan_comment_07_17_18_03.txt,72647,879829985438539_881687545252783
2,m sallu ko etna love krta hu jisko nap ne k liye avi tk kuch ni bna,27757,110661,../../NewData/BeingSalmanKhan_comment_07_17_18_03.txt,72652,879829985438539_881694941918710
0,Maat dekho salman ke bajrange bhai jaan movies 2 ? Salman khan is not a muslim he is a hindu becous Allah sey SAAB SE BAA GUNAA HAIN SHIRK TO Salman kahn shirk kar raha hain 3 KURAN KA farman haain saab se bara gunaa Shirk hain,27762,110672,../../NewData/BeingSalmanKhan_comment_07_17_18_03.txt,72663,879829985438539_881701521918052
0,Hum    ka    bole    is   kamine   salman  ke  bare   me     bolna  to  bahut  kuch  hai    I  heat  salman  khan,27764,110685,../../NewData/BeingSalmanKhan_comment_07_17_18_03.txt,72676,879829985438539_881714975250040
1,salman bhaizan main aap ka sabsa bora frans ho please bhaiza  moza is no 9774192593 ak call dizia pleas mera bhai,27766,110701,../../NewData/BeingSalmanKhan_comment_07_17_18_03.txt,72692,879829985438539_881719738582897
1,apko salman bhai ki kasam mujhe add kijiya,27768,110705,../../NewData/BeingSalmanKhan_comment_07_17_18_03.txt,72696,879829985438539_881726985248839
2,Meri bhai jaan salman khan ilove you,27772,110718,../../NewData/BeingSalmanKhan_comment_07_17_18_03.txt,72709,879829985438539_881752641912940
1,bhai mae tho tayar hae,27774,110725,../../NewData/BeingSalmanKhan_comment_07_17_18_03.txt,72716,879829985438539_881762075245330
1,bhai mai tu kabse tayyar sath me eid manege bhai roza the aj,27779,110734,../../NewData/BeingSalmanKhan_comment_07_17_18_03.txt,72725,879829985438539_881792528575618
1,Kya kare ho,27784,110755,../../NewData/BeingSalmanKhan_comment_07_17_18_03.txt,72746,879829985438539_881818205239717
0,Itni saari qurbani dene k baad fir bhi mai galat hoon,27785,110761,../../NewData/BeingSalmanKhan_comment_07_17_18_03.txt,72752,879829985438539_881819738572897
0,Tumne bhi kabhi saath nhi diyaa to mai akhir galat ho he gai cograss,27786,110767,../../NewData/BeingSalmanKhan_comment_07_17_18_03.txt,72758,879829985438539_881820735239464
0,Sab k saamne mujhe except karne mai tumko sharam aati hogi haina,27790,110778,../../NewData/BeingSalmanKhan_comment_07_17_18_03.txt,72769,879829985438539_881823195239218
1,Jaise tum apne waade k pakke ho waise mai bhi apne waade Ki pakki hoon,27793,110784,../../NewData/BeingSalmanKhan_comment_07_17_18_03.txt,72775,879829985438539_881828378572033
0,Mushkil ye nhi hai k tum mere pass nhi ho mushkil ye hai k tum mere saath nhi ho,27795,110789,../../NewData/BeingSalmanKhan_comment_07_17_18_03.txt,72780,879829985438539_881828831905321
1,aslamo alaikum bhai,27802,110804,../../NewData/BeingSalmanKhan_comment_07_17_18_03.txt,72795,879829985438539_881849241903280
2,very dhamaka song pichli baar jumme ki raat &iss baar party ki raat wow..party aapki taraf se iss party mehi kick hai...,27803,110809,../../NewData/BeingSalmanKhan_comment_07_17_18_03.txt,72800,879829985438539_881855478569323
